Date,Town,Area,Incident
03-May-09,Otmoor,Oxfordshire,"A shiny black flying cylinder, 20-30ft long at about 4700ft which was
200ft above the pilots aircraft. Although the pilot sighted the object.
Air Traffic Control forwarded details to the UFO Desk."
03-May-09,Ammanford,Dyfed,"Seven orange orbs that suddenly disappeared. They were on a
North-South trajectory. Witness contacted Cardiff Air Traffic Control
who had nothing on radar."
04-May-09,Barton near A6,Lancashire,"Nine bright orange lights moving at slow speed and at 2000ft. They
made no sound."
05-May-09,Roade,Northampton,An orange flash and a loud bang.
07-May-09,High Peak,Derbyshire,"Three bright small lights very close together travelling in a straight
line. They were flashing rapidly but made no noise and looked like
they were on fire but clearly were not. Speed of 100-150mph at
1000ft. Came back eight minutes later."
09-May-09,St Helens,Merseyside,"A UFO over the witnesses house. It was at 30,000ft and he has seen
it before."
09-May-09,Harlow,Essex,"A diamond shaped orange light. If you held out your hand it would
have been the size of a 20p coin. It was totally silent. The object
carried on in the distance and then another one appeared and
followed the same path."
09-May-09,Northwich,Cheshire,"Four big lights in a line formation. Two dropped down and the other
two moved off quickly into the distance."
09-May-09,Central London,London,Twenty orange balls heading north.
11-May-09,Tomintoul,Banffshire,"Like a star, but jumping all over the sky. It was 70 degrees above
the horizon. It was a blue/white colour and occasionally red and left
a light trail."
11-May-09,Southampton,Hampshire,A very bright light. It made no sound but was very low.
14-May-09,Nenthead,Cumbria,"A bright orange light. Too bright for a Chinese lantern. The light
looked electrical not a flame. Travelled in a straight line at a steady
speed. Travelled East to West with the wind. Made no noise. It was
about the size of a quarter moon."
16-May-09,Brandon,Suffolk,"Four flaming balloons that disappeared over the horizon fairly
quickly. Was not very high."
16-May-09,Bedford,Bedfordshire,"A strange blue light near the Cardington Hangers. Flew straight past
the witness."
16-May-09,Petts Wood,Kent,"8-10 bright red lights. They were hovering. They moved
independently into the distance and disappeared when a light aircraft
appeared."
16-May-09,Deeside,Flintshire,"Seven bright orange lights in the sky. Silent. Travelling towards the
Wirral."
19-May-09,Redruth,Cornwall,A big bright light. Came from west Cornwall towards Plymouth.
19-May-09,Bexhill-on-Sea,East Sussex,A series of orange balls of fire.
19-May-09,Long Eaton,Nottingham,"An ellipse shaped object the size of a commercial plane. It was on
fire. It glowed bright orange. It moved South East to North and then
returned and hovered for at least a minute. Moved further away at
supersonic speed."
21-May-09,Not Given,Not Given,A very bright blue light flew behind the house.
21-May-09,King's Lynn,Norfolk,"Very strange circular objects without definite shape. They stayed
around for about five minutes. They were 8-9 of them."
23-May-09,Penzance,Cornwall,"Ten orange lights in a line with intermittent gaps. They made no
sound and flew at helicopter height."
23-May-09,Dudley,West Midlands,"A big bright light. Thought it was a helicopter at first. Within seconds
followed by three others and then a further three. Flew low but made
no sound."
23-May-09,Bodium,East Sussex,A strange sighting.
23-May-09,Hove,East Sussex,A very big red light moving slowly. It then faded away.
23-May-09,Winsford,Cheshire,"An orange light travelling from the south. It was followed by two
more orange lights on the same path, then five more and then two
more. They made no noise but were at the height of a helicopter."
24-May-09,Llandaff City,Cardiff,Seven bright red lights.
24-May-09,Wakefield,West Yorkshire,"A white object with a silver beam coming from it, over Pugneys
Country Park. It looked square but changed shape as it moved
about. Witness saw it through binoculars. An aircraft flew very close
to it."
24-May-09,Solihull,West Midlands,"Three objects like fireballs falling to earth. They were glowing and
orange. There was one large object and two smaller ones which
converged together and rose into the atmosphere until they faded
away."
25-May-09,Swansea,West Glamorgan,Three small yellow orbs travelling quite slow.
25-May-09,Bracknell,Berkshire,"A UFO. It was a ""glowing ball of something or other"". Definitely not a
plane."
30-May-09,Spilsby,Lincolnshire,A sighting.
30-May-09,Folkestone,Kent,"A bright circular amber light, the size of a 2p coin. It was moving
very slowly in a straight line but once it flew over the witnesses
house it accelerated away very very quickly into the distance. It
made no noise and left no vapour trail."
30-May-09,"Tunstall to Butley
Road",Suffolk,"Two clusters of bright lights. They were stationary for a while then
the first group of 15 headed towards Woodbridge followed by the
second cluster of 6-7 lights. They were very high up. They made no
sound."
30-May-09,Ballynahinch,County Down,"Three distinct sets of green, orange and white lights. Don't match
any constellation and are in the wrong place. Static to the eye but
with binoculars are moving at speed and at random."
31-May-09,Chapel-en-le-Frith,Derbyshire,"Was watching shooting stars when the witness saw two bright
luminous orange objects like birds or swans. Does not think they
were birds as they moved too fast."
Jun-09,Eltham,London,Black shaped square object.
Jun-09,Baswich,Stafford,"Two objects seen.  Photograph taken in June a week after the
mystery hot air balloon search."
Jun-09,Rowley Regis,West Midlands,"Saw a long greyish tube in the sky, when driving home along the
A4031."
02-Jun-09,Chesterfield,Derbyshire,A sighting.
06-Jun-09,Lewes,East Sussex,Eleven bright star like objects heading North East.
07-Jun-09,Ripon,North Yorkshire,"Bright orange lights. A single light followed by a group of three and
then another single light. On a North East to South West track."
09-Jun-09,Bradford,West Yorkshire,"Different coloured pulsating lights. Police checked with Air Traffic
Control who said they had nothing. Police suspect Chinese lanterns."
12-Jun-09,Shoreham,Kent,"Initially two UFOs increasing to six. Bright orange. Last four were
bigger and brighter than the first two."
13-Jun-09,Porthcawl,Mid Glamorgan,"A very bright orange circular shape. Got smaller as it moved away.
Moving South West to South."
14-Jun-09,Cardiff,South Glamorgon,A UFO.
14-Jun-09,Wroughton,Wiltshire,"Black disc shaped objects hovering over crop circles near Barbury
Castle. They cast shadows on the ground."
18-Jun-09,Stevenage,Hertfordshire,"Two huge lights chasing each other like cat and mouse. It was
broken cloud and the lights would never leave the clouds, just go to
the edge. It looked like a strong light was coming from above the
clouds. They both shot off to the North."
20-Jun-09,Angmering,West Sussex,"A large orange glowing ball in the sky. It was stationary and not very
high up."
20-Jun-09,Abingdon,Oxfordshire,A UFO.
20-Jun-09,Chelmsford,Essex,"Two objects the size of light aircraft but perfectly spherical and
glowing bright orange. They were solid and made no sound. They
headed NW to SE."
20-Jun-09,Not Given,Norfolk,"11-12 objects in the sky. Witness thinks they may be Chinese
lanterns."
20-Jun-09,Angmering,West Sussex,"Ten orange lights moving at a sedate pace West to East. Went from
horizon to horizon in two minutes."
21-Jun-09,Not Given,On the A3,"50-100 objects moving together in the same direction. They were
helicopter sized but made no noise."
23-Jun-09,Hull,Humberside,A light at about 1000ft. It split in two and flew away.
23-Jun-09,Rotherham,South Yorkshire,"A circular object, metallic in colour. It was following a plane. It shot
downwards several times and then back up again to the same level
as the plane."
24-Jun-09,Swansea Bay,West Glamorgan,"A bright circle of fire travelling South Westerly. It was only a few
hundred feet up moving silently across the sky at 30mph and then
after four minutes, vanished."
25-Jun-09,Minehead,Somerset,"Looked like a highly lit aeroplane with wings. It was heading NNW to
SSE. It was visible for 20 seconds then changed direction quickly
and dropped out of the sky or disappeared."
25-Jun-09,Milnathort,Fife,"Witness was watching two helicopters (one a Chinook) coming from
the Edinburgh area when she saw an orb shaped object through her
binoculars glistening in the sun. The orb was quite high above the
helicopters."
25-Jun-09,Bridport,Dorset,"Three orange lights south of Bridport coming from the east. They
were the size of a two thirds moon. Moved away to the West rapidly
diminishing."
26-Jun-09,Chesterfield,Derbyshire,Twelve bright lights in the sky. Moving slowly.
26-Jun-09,Rotherham,South Yorkshire,"Object approached from the direction of Doncaster. It was a bright
orange ball in the sky. It kept a level flight path then stopped. It then
zigzagged a few times before shooting off  at tremendous speed,
vanishing in a few seconds."
26-Jun-09,Moreton-in-Marsh,Gloucestershire,"Six round brilliant objects in pairs, apart from the last two which were
in line. Travelling South to East."
26-Jun-09,City,Hertfordshire,A UFO.
27-Jun-09,Swindon,Wiltshire,"An orange light. Light(s) travelled in formation like a mis-shaped
diamond. There were 12-13 of them. They travelled left to right."
27-Jun-09,Hope Valley,Derbyshire,"Red objects moving slowly. They were not high and were silent.
Might have been going over Bakewell."
27-Jun-09,Bow,London,"Nine objects like golden globes. They hovered for a bit and were
joined by three others before shooting off."
27-Jun-09,Looe,Cornwall,"Two orange balls of light travelling North in parallel to each other.
Then a further ball of light was seen, heading North. The lights made
no noise. They faded and then disappeared."
27-Jun-09,Redruth,Cornwall,"Two brown objects like balls of fire. Appeared to be in convoy
heading towards Portreath."
27-Jun-09,Stafford,Staffordshire,"Four UFOs flying North. They were silent. A plane was flying in the
opposite direction."
27-Jun-09,Pulborough,West Sussex,"Up to 20 orange and red glowing lights. They appeared to be in
formation and under some form of control. They came from the
Eastern horizon. They moved upwards, were then stationary, moved
side to side and then disappeared upwards. Seen for 20 minutes."
30-Jun-09,Hayes,Middlesex,"A roundish glowing shape. Flying at a steady speed with no noise. It
was a clear night. Filmed it but the camera died."
Jul-09,Sheffield,South Yorkshire,Something strange.
01-Jul-09,Swansea,West Glamorgan,"Seemed like a rather large disc or round in appearance. It was dark
in colour but bounced sunlight off its surface. It was floating or
bobbing up and down. Other aircraft were at the same altitude and
could be heard, the object made no noise."
02-Jul-09,Queens Park,London,Two UFOs.
29 Jun-2 Jul 09,Harlow,Essex,"Several sightings over the period. A bright orb that travelled in a
straight line. As a helicopter approached it the orb slowed down and
vanished. Helicopter reacted as if pilot was startled. Saw several
other orbs, but the main one was half the size."
02-Jul-09,Blackwood,Gwent,"A bright orange light seen through the tree line. It turned and cleared
the tree line. The other side of the object appeared to be a large
rectangle shape of fire red/orange. It was silent. The object slowly
climbed in the direction of Gloucester."
03-Jul-09,Cawood,Yorkshire,"Two very bright orange lights that appeared to get closer to the car
then just hung in the sky. Five minutes later a second bright orange
light with red glow seen then disappeared. A third light then hung in
the sky and disappeared after five minutes."
03-Jul-09,Sheffield,South Yorkshire,"Six bright orange/red lights in formation. They climbed like balloons
and made no sound. A sphere like a balloon appeared at the side
and then another."
04-Jul-09,Bideford on Avon,Warwickshire,A round orange light.
04-Jul-09,Teignmouth,Devon,"A bright yellowy orange object, travelling SE to NW in a straight line.
It made no noise. At a 50 degree angle of elevation."
04-Jul-09,Lichfield,Staffordshire,"Eight alien aircraft seen just above helicopter height travelling SW
to NE. There was a humming sound. They looked like they were
""eyeing the place up""."
04-Jul-09,West Grinstead,West Sussex,"12-15 objects. Not like normal fixed wing aircraft, more like bright
orange lights. Moving West at indeterminate height. Objects entered
cloud then turned around."
04-Jul-09,Brighton,Sussex,"A red light followed by 7 others. They came from the West, flew
overhead and disappeared. Definitely not aircraft."
04-Jul-09,Marston Green,Birmingham,"Some 30 orange lights heading from Birmingham Airport towards
Coleshill."
05-Jul-09,Not Given,Not Given,"Three very bright orange lights. Fairly large and moving much faster
than an aircrfat. They disappeared. Then two lights appeared from
the South. The lights appeared co-ordinated. They were not aircraft."
05-Jul-09,"Stratford upon
Avon",Warwickshire,"A dormant blue light which changed colour many times over the
hour it was witnessed. At first it was moving steadily and then it
stopped in  mid air. Then started moving from left to right. A white
beam could be seen shining down from it. It had red lights."
05-Jul-09,Peterborough,Cambridgeshire,"Two objects, one with a brighter light. The second one was behind it
and had a dimmer light. No navigation lights. Not normal. Reluctant
to say it was a UFO - perhaps it is a plane."
05-Jul-09,Bedford,Bedfordshire,A UFO. Witness photographed it.
07-Jul-09,Pagham,West Sussex,"Five orange bright lights. Half a mile distance between each one.
Took photos."
10-Jul-09,Northampton,Northamptonshire,"Fast, shiny discs. Lower and faster than a plane, not a plane or
helicopter. Sphere, brilliant light."
10-Jul-09,Glasgow,Strathclyde,"Two sightings. First at 12:30 (bright light), second at 01:30 (flashing
green)."
10-Jul-09,Finaghy,Belfast,Observed fifty golden balls moving slowly SSE.
11-Jul-09,Palmers Green,London,"Having a BBQ with some friends when saw an orange fireball about
to crash two gardens away, but on checking it was now high in the
sky about half mile away. 3-5 minutes later another object appeared
then a third spherical object with a leg protruding."
12-Jul-09,Oswestry,Shropshire,A UFO.
12-Jul-09,Perivale,Middlesex,"Ball of light. No noise. Bright light, rising behind a fence, went up
into the sky."
12-Jul-09,Stoke on Trent,Staffordshire,"Huge red light, moving through sky."
12-Jul-09,London,Greater London,A UFO.
12-Jul-09,Shrewsbury,Shropshire,No description provided.
13-Jul-09,Worthing,West Sussex,"A large bright silver/white ball/sphere. Moving slowly W to E. the
object was much bigger and brighter than an aircraft. It appeared to
stop still several times as it went into the distance. The light did not
dim as it moved further away."
14-Jul-09,W1,London,"Very bright, very big, not a satellite, not a plane, stationary. Light
disappeared."
14-Jul-09,Taunton,Somerset,"Bright star, went from bright yellow to bright red. Did not look like a
shooting star or plane. Moved no more than 2-3 feet."
14-Jul-09,Woking,Surrey,A UFO.
15-Jul-09,Not Given,Not Given,"A round white object. Not like a ball. Very bright but not casting a
beam of light. It was rising vertically. The higher it went the smaller it
became. It started the size of a pound coin and ended as a pin head.
Witness observed the object for two minutes."
15-Jul-09,Trimley St Mary,Suffolk,"A very bright white light like a star. It moved south then double
backed on itself and was joined by another light. The lights danced
round each other then split and moved off in different directions. The
light suddenly disappeared."
16-Jul-09,"Weston Super
Mare",Somerset,A UFO.
17-Jul-09,Westonbirt,Gloucestershire,"A ball of light the size of a small car, 26 metres above the ground. It
pulsated every 5-8 seconds but then shot off. Definitely not an
aircraft or a Chinese Lantern."
18-Jul-09,Cheshunt,Herts,"A bright orange light, which hovered in one place. It became more
pink, than red and then it disappeared."
18-Jul-09,"Weston Super
Mare",Somerset,"A metallic aircraft shaped like a missile. One quarter was white,
another green/blue and another red. Was circling. It had no wings
and was moving diagonally. It made a sound like a motorbike."
18-Jul-09,Not Given,Lincolnshire,Saw an object like a ball of fire.
18-Jul-09,Rotherham,Yorkshire,Has a video of UFO on his mobile phone.
18-Jul-09,Littleborough,Lancashire,"An orb like object at 120 degrees from North. Orange in colour
moving in a NE direction. Visible for 10 minutes. It had no aircraft
type navigation lights."
18-Jul-09,Ruislip,Middlesex,"Three bright orange lights, not flashing. Very big, high up, set
equally apart. Reported it to RAF Northolt. Never saw anything like
this before."
18-Jul-09,River Severn,Gloucestershire,"A UFO of orangey/red colour. It hovered and moved slightly in the
direction of Stroud, then suddenly dropped downwards."
19-Jul-09,London,Greater London,10-15 circular objects.
19-Jul-09,Newport,Gwent,"A bright, reddish light travelling W to E, below cloud level. It made
no sound. It was moving in a straight line but too slow to be a
meteorite. It had no navigation type lights."
19-Jul-09,Not Given,Not Given,"10-12 bright orange objects, silent. Has a photo of them saved on
his mobile."
19-Jul-09,Leigh,Lancashire,A UFO.
19-Jul-09,Sheffield,Yorkshire,"Six yellow lights, stationary at first then moved off."
19-Jul-09,Nottingham,Nottinghamshire,"Four-five orange lights, fluctuating lights. Lives under flight path of
Donnington airfield. Objects moved in a line. Lights faded. Returned
10 minutes later."
19-Jul-09,Not Given,Cornwall,"Video footage in Cornwall near an Air Station (possibly Culdrose).
Five minute sighting."
23-Jul-09,Hitchin,Hertfordshire,"Large round object. Two planes flew round it. Could be something
natural, such as an eclipse."
24-Jul-09,Ashburton,Devon,"Light seen in sky also above this was a large round shape which
looked rocky and was blue and pink in colour."
24-Jul-09,Newmarket,Suffolk,"15 to 20 orange and red lights looked as though they were coming
down to land but then went over head and 'went out'."
24-Jul-09,Edinburgh,Scotland,"Saw through the clouds flashing pale blue lights odd shapes but
mostly circles. Movement continued for 25 minutes. A small red light
was on outside parameter of blue lights which
disappeared/amalgamated into one large blue light which speedily
disappeared."
24-Jul-09,Barking,Essex,"Bright, oval shaped object with red and green lights. No noise."
24-Jul-09,Bradford,Yorkshire,"Large balloon shape, with 'shimmer fire' effect underneath it."
25-Jul-09,Downham Market,Norfolk,"UFO seen with another one circling it.  There was one main light and
no sound."
25-Jul-09,Kettering,Northamptonshire,"Big and very bright red/yellow/orange ball seen flying past backend
of garden, just under cloud cover. Then went through cloud cover
and lit cloud cover up."
25-Jul-09,Twyford,Berkshire,"Orange light, with 'some sort of flame' in the sky.  Moved from
driveway to over the front of the house.  Then changed direction
towards Wallgrave, direction changed again towards Reading then
back in the direction of Wallgrave."
25-Jul-09,Bury St Edmunds,Suffolk,"Fifteen red/orangey lights in sky, which gradually started fading out
and then disappearing."
25-Jul-09,Henley on Thames,Oxfordshire,"Six orange, with fire around, UFOs in formation (One behind the
other across horizon to horizon)."
25-Jul-09,Plymouth,Devon,"Six orange/white lights, lying astern.  Thought they were aircraft
navigation lights but were evenly spaced out.  No noise but moved
with speed of a passing helicopter. Changed into a 'hammer head'
shape."
25-Jul-09,Dumfries,Scotland,"Six or seven bright lights which were in the sky for approximately 10
minutes. They were spaced out and one by flew away and
disappeared very quickly."
25-Jul-09,Goring by Sea,West Sussex,"Three orange lights high in the sky over the sea.  There was an
explosion and the centre light then dropped into the sea.  No sound
heard from the lights."
25-Jul-09,Doncaster,Yorkshire,"Seven bright orange lights in a straight line. Only two lights were in
view at any time. As the last two came a white moon ball flew over
at double the speed of the orange lights. Thirty minutes later six
white balls in a triangle formation were seen."
25-Jul-09,Newquay,Cornwall,Triangular shaped object.
25-Jul-09,Coningsby,Lincolnshire,"Three huge orange lights. First and second objects moving at speed
of an aircraft. Third object moving much faster as if trying to catch
up."
25-Jul-09,Barnsley,South Yorkshire,"Two bright orange lights, three to four minutes a part and no sound
heard.  Lights then went into clouds."
25-Jul-09,Rochdale,Lancashire,"Five, really bright orange flame ball type objects seen flying across
the sky, moving irregularly. One moving faster than a plane and one
zig-zagged down towards the ground then reappeared after the other
four had moved across the sky and had gone."
26-Jul-09,Hoddesdon,Hertfordshire,"First saw three orange objects. Forty minutes later, looking North
saw an orange glowing object travelling slowly from SW to NE. It
was at an angle to the ground of about 30-40 deg."
26-Jul-09,Brighton,East Sussex,"A bright orange light travelling in a straight line from Brighton
Centre. Which then passed over the house."
28-Jul-09,Bromley,Kent,"Saw an orange, yellow object in the sky, with the shape similar to a
hot air balloon."
31-Jul-09,Not Given,Jersey,Has a UFO report in their office.
31-Jul-09,Peterborough,Cambridgeshire,"Three bright orange lights and one dimmer one. Faded after being
static."
31-Jul-09,Not Given,Not Given,Saw a UFO.
31-Jul-09,Bedford,Bedfordshire,"Went to get cat off wall, saw UFO higher than eye level, bright
orange object, not plane shaped, no engine noise."
01-Aug-09,Chigwell,Essex,Just reported a sighting.  No other details.
01-Aug-09,Preston,Lancashire,"Bright object in sky, very large."
01-Aug-09,Croydon,Greater London,"60-70 lights, suddenly disappearing."
01-Aug-09,"New Mills, High
Peak",Derbyshire,"Nine bright orange circular shapes glide across sky. Sighting lasted
a couple of minutes."
01-Aug-09,Upminster,Essex,"Clusters of UFOs, orange lights in distance. Zoomed off when they
got closer, big and round."
01-Aug-09,South Glenrothes,Fife,Large orange ball of flame.  Lasted 20 seconds.
01-Aug-09,Elgin,Moray,"Lights moving slowly. One light lead a group of five, with one light
acting as tail ender."
01-Aug-09,Michell Coldon,,"17 UFO's above village. Red and green lights, no sound."
01-Aug-09,York,Yorkshire,Orange lights in sky.
02-Aug-09,Not Given,Nottinghamshire,Looked like aeroplane on fire.
02-Aug-09,Not Given,Not Given,Scary sighting.
02-Aug-09,Shirley,Croydon,"Orange point of light in the sky.  No haze or smoke visible around
the object. Object was flickering slightly. Lasted about 60 secs."
02-Aug-09,Preston,Lancashire,Bright light.
02-Aug-09,Hauxton,Cambridgeshire,"Saw glider like objects in the sky. Flying around in an anti-clockwise
direction."
02-Aug-09,Not Given,Not Given,"Red object, looked like a clod, went over the roof and vanished. No
noise/engine. Big orange colour lower than a plane. Gliding straight."
02-Aug-09,Aylesford,Kent,"Large orange glow in sky, moving slowly than disappeared.
Reappeared after five minutes. Knows a bit about astronomy."
02-Aug-09,Kingsbridge,Devon,Low bright light.
04-Aug-09,Woburn Sands,Buckinghamshire,"Saw orange ball in distance, no flashing lights, no engine noise. Left
suddenly."
04-Aug-09,Formby,Merseyside,"Large oval craft seen, very low and could not make out any
distinguishing features. It had on it a number of red, orange and
green lights.  Sighting lasted only 5-10 seconds."
04-Aug-09,Poole,Dorset,"A bright white fire ball, size of a football flew into the kitchen and
landed in a plastic carrier bag on the table, immediately disappeared
but seemed to cause almost blinding white, sheet lightening."
04-Aug-09,Brighton,East Sussex,"Saw an orange light rising from the SE - looked like the tail from a
rocket launch like when the shuttle goes up. Object then moved
north before disappearing behind clouds. Happened three times over
a period of 30 minutes. Third time bright flash."
04-Aug-09,Seaford,East Sussex,Large bright light. Looked like a ball of fire or a hot air balloon.
05-Aug-09,Mitcham,Surrey,"Saw four strange orange lights in the sky following each other.
Lights then just disappeared. Lights then seen again moving across
the night sky.  Went inside and saw the same lights in a three prong
triangle."
06-Aug-09,Hassocks,East Sussex,"Saw six moving orange balls, glowing. They were following each
other.  One minute between them.  There was no noise."
06-Aug-09,Chester,Cheshire,"Orb shape, glowing on underside only. Orange colour. Orange faded
and object looked like a black shadow."
06-Aug-09,Eastcote,Middlesex,Big circular orange lights.
07-Aug-09,Cardiff,Wales,Unusual lights above Cardiff travelling silently.
07-Aug-09,Ullswater,Lake District,"Six balloons of fire over Ullswater.  These UFOs moved at different
speeds to each other and in different directions before burning out."
07-Aug-09,Cardiff,South Glamorgon,Unusual lights travelling silently from West to East.
