Date,Town,Area,Incident
26-Oct-09,Eastbourne,Brighton,"Like a flying bonfire, or similar to a plane on fire, too dark for a
balloon."
26-Oct-09,Kirkby,Liverpool,"Three bright orange objects, hovered for five minutes, before
ascending straight up into the sky. Strangely shaped. Another at
17:52 & on 9 Oct at 20:00."
26-Oct-09,Bolton,Lancashire,"Red and orange lights high in the sky moving slowly, numerous
sightings over several weeks."
26-Oct-09,Malton,Yorkshire,Strange lights in the sky.
27-Oct-09,Hamilton,Lanarkshire,Two fiery red flame like objects hovered about then disappeared.
27-Oct-09,Chesterfield,Derbyshire,"Bright orange spheres, got smaller the further away they went."
27-Oct-09,Barlborough,Derbyshire,"Lights in the sky, no object.  Orbs with trails following, moving in a
circular direction.  Four orbs, two following the other two reaching a
point then repeating the sequence."
28-Oct-09,Alvaston,Derbyshire,"Two glowing crosses 50 metres apart silent, more 5 to 6 minutes
later, intelligent craft."
28-Oct-09,Derby,Derbyshire,No description provided.
28-Oct-09,Evesham,Worcestershire,"Airborne craft with non-conform lighting, steady strong orange."
28-Oct-09,Warbleton,East Sussex,10-12 orange lights in a row with no sound.
28-Oct-09,Bensford,Staffordshire,"One orange light not flashing, three in a triangle formation."
28-Oct-09,Charnock Richard,Lancashire,Ten flaming balls of fire.
28-Oct-09,Salcombe,Devon,"Three to four silent aircraft three leading one trailing, bright red
lights."
28-Oct-09,Hampton Court,SW London,"Bright orange glow arched over him appeared for 15 seconds then
went upwards."
29-Oct-09,Norwich,Norfolk,Large orange ball no noise or flashing.
30-Oct-09,Great Barr,Birmingham,Really bright light jellyfish shaped object.
31-Oct-09,Maesteg,Bridgend,"Orange red sphere giving off light moved up into the clouds without
making any noise."
31-Oct-09,Netherton,Liverpool,"Large spherical ball looked like it was on fire, small objects dropped
from it, then flew away."
31-Oct-09,Leicester,Leicestershire,"Bright orange glow triangular shape, very bright, flew up into the sky,
silent."
31-Oct-09,Huddersfield,West Yorkshire,"Bright burning white light, continued at steady pace glowing bright
orange and visible in distance, could have been firework, but
possibly not."
31-Oct-09,Diss,Norfolk,No UFO details left.
31-Oct-09,Birmingham,West Midlands,"Strange orange shape in the sky, pulsating top half less bright,
silent."
31-Oct-09,Llynfi Valley,Mid-Glamorgan,Orange oval UFO passing by.
31-Oct-09,Winchburgh,West Lothian,"Cylindrical shape, flying low, silent, two large red navigation lights
on body, flashing red strobe lights, then disappeared from view."
31-Oct-09,Derby,Derbyshire,Circular with yellow and white lights.
31-Oct-09,Westbury,Wiltshire,"Circular bright light, definitely not a helicopter."
31-Oct-09,Norton Canes,Cannock,"Six objects, five large red balls, no lights moving steadily one behind
the other, for 10-15 minutes.  Sixth twice as big."
31-Oct-09,Hove,Sussex,"Five large round orange balls of lights in a formation: two front, one
middle, two at the back, no sound."
31-Oct-09,Bosham,Chichester,"Three UFOs sun bright orange looked like flames and had sort of
wings. First two were 2-3 miles apart, later one 10 miles to rear all
going to the right no sound."
31-Oct-09,Not Given,Not Given,"Orange light no noise, appeared for around 8 minutes."
31-Oct-09,Gravesend,Kent,Yellow assorted lights much brighter than an average star.
01-Nov-09,Glasgow,Strathclyde,Large orange object.
01-Nov-09,Humberston,NE Lincs,"Six lights in S shape misty sky ground clear, gradually disappeared."
01-Nov-09,Beckenham,Greater London,"Three orange objects, then four more joined them."
01-Nov-09,Leeds,,Orange circular lights very fast going West to Leeds centre.
01-Nov-09,Matlock,Derbyshire,"Very bright light in the sky changing to green, no noise."
02-Nov-09,Kensal Green,London,No description provided.
03-Nov-09,Bristol,Avon,"Clear and bright object long bluish white light with narrow tail, fast,
gradual descent."
03-Nov-09,Clacton,Essex,"A single object full of lights approximately the same size as 10
planes, the object made no noise.  Lights were seen to dim and
change colour with some turning off.  Object was described as a
straight line of lights with a ""U"" shape attached underneath."
03-Nov-09,Pontefract,West Yorkshire,"Like a balloon or lantern, hollow with bright orange light inside."
03-Nov-09,Tipton,West Midlands,"Bright red light with no engine noise, glowed brightly then faded."
04-Nov-09,Cannock,Staffordshire,"Bright white light blinking on and off every 2-3 seconds, stayed for 2-
4 minutes then disappeared."
05-Nov-09,Not Given,Not Given,"UFO reported, definitely not a firework, third time he has seen a
UFO but first time he has reported it."
05-Nov-09,Peterlee,NE England,12 orange lights silent but moving fast.
05-Nov-09,Featherstone,West Yorkshire,"Ball of fire moving across the sky, white hot at one end, moving for
too long to be a firework."
05-Nov-09,Bolton,Lancashire,"Bright orange light moving fast across the sky appeared lots of times
and moved in directions that cannot be explained."
05-Nov-09,Bolton,Manchester,UFO appeared several times during the night.
05-Nov-09,Pontarddulais,Swansea,"Silent, off red, blood orange colour and entire sphere emitted light.
No spotlights. Light remained constant and didnt flicker. Saw for
four minutes."
05-Nov-09,Newton Grange,Mid Lothian,"21-22 high flying objects shining red at even intervals for around 15
minutes."
05-Nov-09,Burwarton,Bridgnorth,Big orange ball moving slowly.
05-Nov-09,Stockport,Not Given,"Amber glowing ball quarter of the size of the moons diameter,
dimmed to nothing then vanished."
05-Nov-09,Bourne,Lincolnshire,"Four UFOs, three close together one behind, bright red glow around
a light with glow on the bottom no noise was close."
05-Nov-09,Leigh,Lancashire,"Large triangle structure with red light in each corner, red with fire in
the middle."
06-Nov-09,Crawley,East Sussex,Orange lights in sky moving slowly then fading away.
06-Nov-09,Ironbridge,Shropshire,Eight sightings not chinese lanterns saw one more a week later.
06-Nov-09,Heckmondwike,West Yorkshire,"Formation of six bright orange lights in the sky, one minute behind
were two more, then one more the last was much bigger and
brighter."
07-Nov-09,Not Given,Not Given,Two bright orange lights.
07-Nov-09,Not Given,South Africa,"Flat object in sky moving at rate of knots, looked strange."
07-Nov-09,Central London,London,"Saw several very bright lights flying and drifting quickly and silently
up in the sky.  They were bright, flickering, tiny white, green and light
red lights. I counted at least 10-15, some seemed to be drifting in
groups and others separately."
07-Nov-09,South Birmingham,West Midlands,"Two orange glowing orbs silent travelling in a straight line not
travelling fast and in tandem. Disappeared over Moseley area. Not
fireworks."
07-Nov-09,Colchester,Essex,"Four slow moving round orange lights, completely silent, seemed to
turn white and were pulsing."
07-Nov-09,Not Given,Not Given,Six orange lights not fireworks.
07-Nov-09,Tring,Hertfordshire,Reddish amber bright object flying across sky.
07-Nov-09,Cusworth,Doncaster,Saw UFO definitely not chinese lanterns.
07-Nov-09,Hemel Hempstead,Hertfordshire,Two red and bright lights but not glowing.
07-Nov-09,Peterborough,Cambridgeshire,"Orange sphere 30 degrees above eastern horizon speed substantial,
no noise no normal navigation lights just eerie orange glow."
07-Nov-09,Peterborough,Cambridgeshire,"No details given.  Two separate messages left asking to be
contacted."
07-Nov-09,Callander,Perthshire,"Up to 20 individual orange lights, static for 15 seconds before tilting
then moved off."
07-Nov-09,Gillingham,Kent,"Two UFOs bright orange lights appeared from nowhere, faster than
a plane."
08-Nov-09,Oswestry,Shropshire,Orange light not a firework.
08-Nov-09,Porthcawl,Mid-Glamorgan,No description provided.
08-Nov-09,Ipswich,Suffolk,No description provided.
08-Nov-09,Telford,Shropshire,"Two orange lights moving slowly south.  No sound, not jet
afterburners, not helicopters as they did not flash.  Wrong colour for
distress rockets."
08-Nov-09,Maidenhead,Berkshire,"Fiery ball, no flashing lights, variable speeds, disappeared into a
star, was red and burning"
08-Nov-09,Leicester,Leicestershire,"Three lights in sky 5 x 3 groups of disc shapes in a triangle
formation."
09-Nov-09,Port Talbot,Bryn Valley,"Orange yellow UFO no contrails, no hazard lights flashing."
09-Nov-09,Whitley Bay,Tyne & Wear,"Orange ball shape going across the sky on a flight path.  Silent.  So
concerned called 999."
09-Nov-09,Plympton,Devon,"Red and orange sphere half the size of the moon, no noise, but bits
were falling off it, tracked it for 20 seconds, saw a plane four
minutes later which might have seen it."
10-Nov-09,Nottingham,West Bridgford,Seven orangish orbs floating over house in formation.
10-Nov-09,Glasgow,Pollock,"Four lights moving around in a circle over and over again for more
than an hour."
11-Nov-09,Glasgow,Glasgow,A kaleidoscope effect of lights above the building.
11-Nov-09,Edenbridge,Kent,"Very bright yellow in the centre surrounded by orange outer edge, a
fat boomerang on its side with a fire glow inside. Totally silent and
30-40 ft across."
12-Nov-09,Northumberland,Northumberland,"Two very bright, large lights, one higher than the other.  The lower
one then disappeared and reappeared above the higher one, they
swapped sides and then evened out to same level.  They
disappeared when a planed came into view."
14-Nov-09,Haddenham,Cambridgeshire,"Large bright white light, no trailing light ray groundwards, so not a
police helicopter or aircraft heading for Mildenhall.  And no sound or
vibration."
14-Nov-09,Shrewsbury,Shropshire,"Bright light hovering in the sky, three parts, one was red appeared
for 45 minutes before it disappeared."
14-Nov-09,Ellesmere Port,Wirral,"Seven to eight bright orange flame lights in the sky, not plane or
helicopter, no noise and moved fast, then disappeared."
15-Nov-09,Milford On Sea,Hampshire,"Tiny speck of light over Southampton direction.  Seen twice by
binoculars.  N/NE explosion and bang, but not thunder lightening or
firework, lasted 30 seconds."
16-Nov-09,Not Given,North Yorkshire,"Two small red lights moving across the sky like fighter jets, but not a
fighter jet, reappeared again an hour later."
19-Nov-09,Rumney,Cardiff,Four lights whirling about above the nature reserve.
19-Nov-09,Hollerton,Bradford,Small ball of fire.
20-Nov-09,Cattleford,Yorkshire,"A mushroom shape light (like a balloon blowing in the wind) being
tracked by three brightly lit aircraft, saw approx 6-7 mushroom
shapes and four aircraft.  Couldn't hear any engines."
22-Nov-09,Farnham,Surrey,"Saw a bright red and orange object there was no noise or boom.
Believe it was a probably a meteor."
25-Nov-09,Long Marston,Yorkshire,"Ten unidentified lights in the sky appeared for five minutes one after
the other."
25-Nov-09,Doncaster,Yorkshire,"Saw a very large bright orange ball of fire travelling over woodland.
There was no sound.  In size would have been 20 to 30 times bigger
than a jumbo jet."
26-Nov-09,Wymondham,Norfolk,"Two orange large circular objects crossing the sky equal distance
apart, uniform speed, not shimmering, larger than a plane, half a
metre in diameter."
28-Nov-09,Blackline Hill,Northamptonshire,Lights in the sky going up and down for the last half hour.
28-Nov-09,Witney,Oxfordshire,"Very bright orange light in the sky always around 9pm, has appeared
four times recently, not a plane and no other explanation other than
UFO."
29-Nov-09,Hill Green,Cheshire,"Two orange lights moving slowly over Wilmslow veered off in a
different direction.  No noise and flashing flights not aircraft."
30-Nov-09,Wilnecote,Staffordshire,"Strange orange light coming from the North, clear night, no port and
starboard indicators, translucent halo, lasted 1 min 20 secs, constant
speed, straight line."