Date,Town,Area,Incident
07-Aug-09,Barnston,Merseyside,"Six to seven bright orange lights, moving down Wirral peninsula
from Birkenhead to Ellesmere Port. No noise. Saw a second UFO
five minutes later."
07-Aug-09,Wirral,Merseyside,"Eight orange, non-flashing lights, made no sound. Round shapes."
07-Aug-09,Coningsby,Lincolnshire,"Four wavering lights, hovering, taken on a video camera and
photographed."
07-Aug-09,Nuneaton,Staffs,Five to six objects.
07-Aug-09,Newport,Shropshire,"Two yellow lights one above the other in the sky.  On arriving home
five minutes later watched the lights disappear behind a narrow
cloud bank."
08-Aug-09,Not Given,Not Given,"Two sightings observed. One in summer 2008 single bright
yellow/white light moving fast. Second sighting in daylight single
bright yellow/white 2009 moving fast."
08-Aug-09,East Kilbride,Lanarkshire,"Bright orange bulb. Stayed for 10 minutes, came towards him like a
tornado then disappeared."
08-Aug-09,Saltcoats,Ayrshire,"Very large bright light, no sound."
08-Aug-09,Stockport,Cheshire,"Bright orange object which looked as though it was on fire. Moving
at a steady pace, slowed then gained altitude slowly and
disappeared into the clouds.  Sighting lasted 2-3 minutes.  Object
was similar to a hot air balloon but had no outline or shape."
08-Aug-09,Not Given,Not Given,"Bright light form the northwest - lights went out, turned towards the
south."
08-Aug-09,Bradford,Yorkshire,"Saw a very bright orange ball shaped object in the sky. No noise
from object. Went to get mobiles to take pictures and videos but
object had just vanished."
08-Aug-09,Northampton,Northamptonshire,Lights coming towards me. 40-50 lights.
09-Aug-09,Huddersfield,Yorkshire,One object seen in the sky in the day time.
09-Aug-09,Not Given,Not Given,"Report received from ""Psychic Control Centre"", ref: PO255401."
10-Aug-09,London,Greater London,"Report on behalf of her sister, who said she saw a UFO at Holborn
Station."
10-Aug-09,Northampton,Northamptonshire,"Bright red orange ball, no sound, moved faster than an aircraft.
Could not find a camera in time to take photos."
11-Aug-09,Rayleigh,Essex,"UFO visible for 6 -7 second. Changed direction by approx 60 degs
downward towards the horizon before disappearing. Object was a
dull brown colour, with a magnitude of 3.5 to 5 and resembled a
slightly luminous brown paper bag. No sound was heard."
11-Aug-09,Thorpe-le-Soken,Essex,"Saw a meteor shower which contained something he could not
explain."
12-Aug-09,Morfa Nefyn,Pwllheli,"Bright light shone through the window. Saw three lights size of a
basket ball moving up/down and rotating on own axis. Seemed to
loose power after 30 seconds and vanished."
13-Aug-09,Preston,Lancashire,"Dog wanted to go out, went out and I saw a UFO."
15-Aug-09,Billericay,Essex,"No flashing lights, orange looking object. Looked like it was
hovering, flew towards observer's car and faded slowly into the
distance."
15-Aug-09,Wimborne,Dorset,"Pair of ""lanterns"" directly overhead, slightly faster than a plane,
faster than a satellite, slower than a meteor."
16-Aug-09,Westmuir,Moray,"One light, joined by another, hovering over the village. No noise.
One light no longer there, the other disappeared. Like a lightbulb
with an orange top"
17-Aug-09,Langport,Somerset,"Very bright light, stops and spins slowly, moves right and left, as if
looking for something or taking photos, long beams of light. No
sound."
17-Aug-09,Newport,Gwent,"Bright orange light, definitely not a plane."
17-Aug-09,Altrincham,Lancashire,Two bright orange lights. Witnessed for about five minutes.
17-Aug-09,Wythall,Birmingham,"Emitting a large bright orange light much larger than normal lights
on a plane/helicopter, travelling in an arc with no sound. After 10
mins light became dimmer and appeared to gain height, light now
size as normal aircraft light and disappeared."
19-Aug-09,Exmouth,Devon,"A bright orange object. Above cloud level. Travelling at a high rate
of knots. Came inland from the coast over Exmouth and headed off
towards Woodbury and Taunton."
19-Aug-09,Northampton,Northamptonshire,"Was carrying a camera, as is her usual practice, saw a pinpoint, a
silver dot that was clearly a UFO."
19-Aug-09,Withington,Lancashire,"Three red lights in the shape of a triangle with the nose moving
forward, not a usual aircraft, suspect it was a UFO."
20-Aug-09,Cliftonville,Kent,Three orange orbs and two red orbs.
20-Aug-09,Herne Bay,Kent,Wish to report a UFO.
20-Aug-09,Shebbear,Devon,"Circular shape in with a mixture of stars, one was getting brighter
and then dimmer and disappearing for a short number of minutes.
Another red light hovered around the object. Camera on phone
would not pick anything up."
22-Aug-09,Chesterfield,Derbyshire,Lights in sky.
22-Aug-09,Mansfield,Nottinghamshire,Saw a UFO - can you call me back.
22-Aug-09,Not Given,Not Given,Saw something strange. Can you phone me back.
22-Aug-09,Not Given,Not Given,Five orange globe balls.
22-Aug-09,Not Given,Not Given,UFO at the back of the sky
22-Aug-09,Harpenden,Hertfordshire,"Tall and thin, like a pencil, square, blue black."
22-Aug-09,Northampton,Northamptonshire,"Saw 40 flickering orange lights from kitchen window. They made no
noise and moved round to the side window of the house and
disappeared behind a cloud.  Watched them for 5-10 minutes."
22-Aug-09,Stevenage,Hertfordshire,"Two orbs, flickering lights, sliding across the sky."
22-Aug-09,Gerrards Cross,Buckinghamshire,"Around eight yellow balls of light floating slowly in the night sky,
slowly disappearing. Then one or two more would appear 500 to 800
ft and follow same line of flight.  This happened for around two
minutes."
23-Aug-09,Skegness,Lincolnshire,Large orange light with no noise.
24-Aug-09,Derby,Derbyshire,Saw a UFO.
24-Aug-09,Tunbridge Wells,Kent,"Bright orange lights, lasted for two minutes, went out, than four
more. Could have been a meteorological balloon. A very bright light."
24-Aug-09,Swindon,Wiltshire,"Three lights in formation, forming an isosceles triangle. Two lights
visible at first, then joined by a third. Light lasted for 2-3 minutes. No
sound."
24-Aug-09,Lewes,East Sussex,Report of a UFO.
24-Aug-09,Hersham,Surrey,"A large orange fireball burning for 35 seconds. No noise from object
which reduced in size until nothing over the duration of its flight."
24-Aug-09,Glasgow,Strathclyde,Strange lights over G62 0TD. Two big white lights.
25-Aug-09,Derby,Derbyshire,Seven aircraft over Derby.
25-Aug-09,Shebbear,Devon,It got brighter and dimmer
27-Aug-09,Not Given,East Anglia,Came over top of field - red- flew very quickly like a shooting star.
27-Aug-09,Dronfield,Derbyshire,"Round shape - lightening then darkening with a dark shape behind it.
No engine noise."
27-Aug-20,Manor Park,London,Saw a bright light heading towards Essex - bright light standing still.
28-Aug-09,Not Given,Not Given,"Orange ball going in a straight line.  No visible trail.  No smoke or
noise. Appeared to be getting smaller burning itself up."
29-Aug-09,Sark,Guernsey,"Saw what looked like a flying log, blue with a white edge."
29-Aug-09,Kings Lynn,Norfolk,"Terrestrials seen coming from King's Lynn towards Swaffham,
Norfolk."
29-Aug-09,Gloucester,Gloucestershire,Saw a sighting in Gloucester.
29-Aug-09,Gloucester,Gloucestershire,Two UFOs flying overhead.
29-Aug-09,Bearsdsen,Glasgow,Has video of UFO with no sound.
29-Aug-09,Kettering,Northamptonshire,"Two glowing sphere/domed -shaped objects followed each in South
East direction.  Completely silent and not flashing at all, as you
would expect from aircraft."
29-Aug-09,Plymouth,Devon,"One object rising in the sky. Semi circle outline. Flames glowing
orange/red.  Flickering round the edge. At first thought it was a
firework, then it disappeared."
29-Aug-09,Yeovil,Somerset,Seven lights over Yeovil.  No noise.
29-Aug-09,Lyneham,Wiltshire,"Orange lights following each other in same direction. No noise, no
flashing lights, same trajectory. In vicinity of Lyneham radar.  Some
lights disappeared."
29-Aug-09,"Stratford-upon-
Avon",Warwickshire,"Saw lights, moved into view from right to left, then stop and form a
pattern before pulsing and fading out their bright orange lights."
29-Aug-09,Telford,Shropshire,"Twenty-two lights.  No noise, same speed."
29-Aug-09,Smethwick,West Midlands,"Saw strange lights in the sky, in three's then one, then two's, then
three's - Fifteen in all."
30-Aug-09,Blakeney,Norfolk,"Red fire like ball . Glow was constant.  It was travelling at a constant
speed West to East. Also watched it through binoculars and it
appeared as a red circle with dots around the circle. In 10 o'clock
position and watched it for 4-5 mins."
30-Aug-09,Petts Wood,Kent,"Saw eight orange single lights in the sky. Lights were very clear,
single bright orange spot, which travelled at constant speed slowly
higher into the eastern atmosphere. At first four lights in close
proximity followed by four more with approx one minute."
31-Aug-09,Ashingdon Heights,Essex,"Approx 10 orange lights flying over. First eight were going at a
steady, slow rate, three of which merged into a triangle formation,
separated then disappeared. Two others appeared about a minute or
so travelling faster and disappeared at same area of sky."
31-Aug-09,Not Given,Thames Estuary,"Saw a vertical cylinder, silvery colour and underneath was a great
bright yellow, fiery glow.  Watched the object for about 20 minutes."
31-Aug-09,Twickenham,Middlesex,Ball of fire in the sky.
Sep-09,Penarth,South Wales,Very bright object above the sun.
Sep-09,Catford,London,"Six bright orange lights - not flashing - silent. After a few minutes
there was another one."
Sep-09,Sherborne,Dorset,"Saw a very bright light - looking south to right of the moon.  It was
very large.  There were four or five bright lights."
01-Sep-09,Inverness,Scotland,"Moving very fast SE to North and watched object for about 10
seconds. Thought at first it was a star or a plane."
02-Sep-09,Filey,Yorkshire,"Brilliant and dazzling pure white horizontal ring of light.  It appeared
to be perfectly still in the sky above the houses and was totally
silent.  Object was hovering over the Belle Vue Crescent area."
02-Sep-09,Leeds,Yorkshire,"Low flying object.  Nine orange lights, no sound."
04-Sep-09,Ashton Under Lyne,"Greater
Manchester","Eight, orange UFOs, shone brightly, travelling at speed, low in the
sky. Objects came across one by one with approx 20 seconds
between them. They stopped over the reservoir changed direction at
approx 90 deg angle towards Holmfirth.  No noise."
05-Sep-09,Not Given,Kent,"Semi-circle of light, golden orange, moved off towards the east.  No
noise heard."
05-Sep-09,Oakwood,Essex,"Saw 25 to 30 bright orange lights in the sky - Flying in a triangular
shape."
05-Sep-09,Frome,Somerset,Fifteen to twenty bright vertical line going slowly - no noise.
06-Sep-09,East Kilbride,South Lanarkshire,"Saw three UFOs which appeared to be composed of fiery orange
light and a symmetrical vertical diamond shape.  No sound."
08-Sep-09,Diss,Norfolk,"Pink and red dome with a bright yellow light underneath. For about
30 seconds."
08-Sep-09,RAF Valley,Anglesey,Two round balls were in the sky chasing each other.
09-Sep-09,Epsom,Surrey,"Thirty orange globes, in four waves, travelling at a constant speed.
May have been lanterns of some kind but they would have been 1-2
Metres in diameter."
09-Sep-09,Old Bilsthorpe,Nottinghamshire,"Saw Orange flamed lights, in formation slowly and silently across
the night sky."
09-Sep-09,Tooting,London,"Black sphere. Bobbing about half a mile away . Covered with a
phospherous chemical cloud.  It goes light grey. Flash of lightening
then re-appears. Some of the clouds light up.  Various sightings
20:30 and 12:15."
10-Sep-09,South Hinksey,Oxford,Saw a UFO it was not a plane it disappeared very quickly.
10-Sep-09,Godalming,Surrey,"An intense, bright white light seen between the flight path of Gatwick
and Heathrow."
10-Sep-09,Norwich,Norfolk,Just a sighting.
11-Sep-09,Charles Barn,Kent,"White fixed wing object. Flying over a field, East Street, Charles
Barn.  It was squared off with something behind it - no cockpit- silent
not a glider."
11-Sep-09,Not Given,ANsoht tGoniv-eunnder-,"Saw over the roof of their house orange/gold round circle about the
size of a beach ball moving from behind the house going sideways
across the roof  and down the road. As it moved down the road it
change to a smaller light with no fiery glow."
12-Sep-09,Cockbrook,Lyme,Twelve circles.
12-Sep-09,Belfast,Northern Ireland,"Three blazing gold orbs in a diagonal line in the sky. No sound.
Remained static approx one minute before moving slowly together
to form a shape like Orion's Belt and then into a small triangle. Two
lights further out faded and disappeared then third too."
13-Sep-09,Shepton Mallet,Somerset,"Seven silent objects emitting a bright orange light. One group of
three and then singles. Travelled at about 100 knots then turned
right."
12-Sep-09,Grantham,Lincolnshire,"Seven objects. One group of three, followed by one group of four.
Orange, large no distinct shape. Bright, no noise."
12-Sep-09,St Ives,Cornwall,"Saw bright orange red light in the sky.  The light took several
minutes before it began to dim. Its path was straight and steady,
indicating perhaps powered flight."
12-Sep-09,Mansfield,Nottingham,Strange red and orange object in the sky.
17-Sep-09,Findon Valley,West Sussex,"Saw an extremely bright star like light in sky. Continued flying then
started to climb vertically no change in speed the dimmed and
disappeared to a faint light."
19-Sep-09,Bromley,Kent,A bright orange light moving across the sky no noise.
19-Sep-09,New Forest,Hampshire,"Saw an object in sky like a fireball. It burnt pretty brightly, then would
burn out a little then appear to burn brightly again before
extinguishing about thirty seconds later."
19-Sep-09,Sheepridge,Huddersfield,"Six to eight red lights moving across the skyline. Red spheres with a
white centre. Eventually passed over the house from back to the
front."
19-Sep-09,Carluke,Lanarkshire,"Saw an orange light in the distance.  It came nearer and eventually
disappeared into cloud overhead but before it did saw other similar
lights appearing in the distance. They were travelling at regular
intervals."
19-Sep-09,Watford,Hertfordshire,"Saw three consecutive passes of single, bright yellowish lights.
Moving approximately three minutes apart on the same orbit."
19-Sep-09,Betws,Dyfed,"Three objects, like bright orange tennis balls stuck together flying
across the sky."
19-Sep-09,Anglesy,North Wales,"Object was similar to an egg shape and was amber in colour and
appeared to be hovering over  field's before disappearing.  Five
minutes later two objects appeared in same area, then disappeared
and reappeared over the Meni Straits."
19-Sep-09,Burnley,Lancashire,Orange light in sky.
19-Sep-09,West Wickham,Kent,"Series of 30 or more orange lights which then disappeared after
moving at speed."
19-Sep-09,Arbroath,Angus,"Saw four lights travelling together. One veered off heading East.
Three remained in a triangle formation. Two disappeared into the
horizon and one light went overhead. Looked like a red fireball no
sound."
19-Sep-09,Not Given,Lanarkshire,"Saw eight to ten lights in the sky. First appeared like very bright
fireworks which are fired vertically into the sky. In no particular
pattern stayed at same flight level, no engine sound. Picked up
speed and disappeared. Lasted about five minutes."
19-Sep-09,Letchlade,Gloucestershire,"Forty to fifty orange lights following the same trajectory with more
lights coming over."
20-Sep-09,Mulbarton,Norfolk,"Two orbs in the sky.  Lead aircraft stopped dead in mid air then
backtracked for a second or two before rising directly vertical approx
200-500m then stopping. As lead craft came within 50m of other
craft both headed off into the distance."
20-Sep-09,Harpley,Norfolk,"Two orange lights travelling over Harpley village and did not flicker
or flash. Distance between the lights was approx 10m and 60ft
above ground and there was no sound. Turned car around but it had
disappeared."
20-Sep-09,Bristol,Bristol,"A red/orange light passed over head. Looked like a gaseous, golfball
with a red rotating light, rotating clockwise inside it."
20-Sep-09,Moreton-in-Marsh,WGleosutc estershire,"Six strange lights flew low no sound of engines with orange, red and
other colours."
20-Sep-09,Clydebank,Dunbartonshire,Saw five orange lights in the sky in a line.
21-Sep-09,Kenilworth,Warwickshire,"A very unusual object flew across the sky.  The object was a cone
shape with a circular top.  It had an orangey/red light in the middle
and an outer see-through red/pink layer."
22-Sep-09,Earlsdon,Coventry,"Six orange orbs floating in an arc in the sky. All following the same
trajectory and faded at similar points in the sky."
24-Sep-09,Bradford,Yorkshire,"Saw an object which was round, yellowish colour.  Had a clear view
of the sighting for about two-three minutes."
24-Sep-09,Not Given,Not Given,"Fifteen to twenty very bright orange lights travelling about a mile
apart and in perfectly straight line."
24-Sep-09,Hednesford,Staffordshire,"Large orange light, stopped for several minutes and then
disappeared."
25-Sep-09,Long Melford,Suffolk,"Pulsating/shimmering object flashing red, blue and green."
26-Sep-09,High Peak,Derbyshire,Eight orange lights over top of house.
26-Sep-09,Chatham,Kent,"Two orange balls of light. One ball of light was leading with the other
two behind it.  No sound of any engines."
26-Sep-09,Tattershall,Lincolnshire,"Three separate orange lights with no sound, hovered for approx 40
minutes then blanked out of sight."
26-Sep-09,Ditton,Kent,"Three bright orange/red lights, followed by another three."
26-Sep-09,Peterborough,Not Given,"Loads of lights coming over the village, gaining height very quickly."
26-Sep-09,Cradley Heath,West Midlands,Seven lights.
26-Sep-09,Formby,Lancashire,"Large luminous, pulsating object changed colour and shape."
26-Sep-09,Grangemouth,Stirlingshire,"Two bright orange objects. One from south at ferocious speed, then
dead halt with others. Not man-made, no sound."
26-Sep-09,nr Gatwick Airport,Sussex,"Five UFOs, two miles to the North East of Gatwick. They all shot up
in the sky and disappeared one by one."
26-Sep-09,Letchworth,Hertfordshire,"Orange object in sky getting higher and higher looked like a plastic
bag with a flame in the middle. Round and glowing. Stopped in the
middle of the sky and disappeared."
26-Sep-09,Farncombe,Surrey,"Two orange/red dots in the sky. Seemed to be still but slowly moved
adjacent to one another.  One then disappeared followed about a
minute later by the other."
26-Sep-09,Matlock,Derbyshire,"Saw three orange lights, then as they rounded a corner saw five in
formation. No noise."
27-Sep-09,Deal,Kent,Silver object in sky over Deal.
27-Sep-09,Lincoln,Lincolnshire,"Could not see a defined shape but no noise, no rear, port or
starboard lights. Two coned lights (yellow and white) flickering
randomly. Finally disappeared into cloud."
27-Sep-09,Northolt,Middlesex,"Saw two UFOs. Looked like balls of fire.  As they approached RAF
Northolt the fireball went out. However, the craft was still visible and
was in the shape of a jelly fish dome."
27-Sep-09,Maghull,Liverpool,"A perfect rectangle the length of car but 3 ft wide. Started swaying
then swooped like a bird. Witness followed it through the town."
29-Sep-09,Connah's Quay,Flintshire,"Bright orange light, 1cm deep, joined by a second light, no sound."
01-Oct-09,Chippenham,Wiltshire,Lights not sure what number.
01-Oct-09,M1 South,,"Very sharp turn in jet stream, very sharp for an aircraft and very high
up like a usual Airliner height."
02-Oct-09,Hastings,East Sussex,"Saw eight oranges lights on an oblong shaped object, no noise."
03-Oct-09,Woking,Surrey,"Eight lights at intervals, slowly flying."
03-Oct-09,Not Given,Kent,Little moon thing.
03-Oct-09,Hove,East Sussex,"Two bright objects. Disk shaped with red light that goes orange and
then back. On one of them the light went on and off and then they
both went out. It looked like there was only one light on the ship."
04-Oct-09,Not Given,South Pennines,Bright orange lights in the sky.
04-Oct-09,Stonehaven,Aberdeenshire,White and red lights moved around.
04-Oct-09,Chipping Sodbury,Bristol,Ball of fire shot across the sky over her house.
04-Oct-09,Halesowen,West Midlands,"Two orange glows, travelling quite fast, one in front of the other.
Turned sharply and formed what appeared to be a triangular or
arrow shape."
04-Oct-09,Tiptree,Essex,"Fire in the sky, orange, moving slowly, hovered, the flames went out
and it was 45 degrees from the ground."
04-Oct-09,Pudsey,Leeds,"Incredibly bright light in sky, at first light was white but changed to
bright orange.  Appeared to be big and pulsating and followed him.
Light shot across sky then disappeared."
05-Oct-09,Cardiff,South Glamorgon,Two objects seen in sky.
05-Oct-09,Not Given,Sussex,"Two bright lights hovered, then turned north and headed inland."
08-Oct-09,Luton,Bedfordshire,"Red and Green lights in sky with twinkles underneath, 3-4 minutes
hovering, shot up and came back down, and hovered then shot off.
Funny noises on mobile phone recorded."
08-Oct-09,Southgate,London,"Three red/orange lights in the shape of a triangle.  Moved silently
with an exhaust type object coming from it."
09-Oct-09,Edinburgh,Midlothian,No details given.
10-Oct-09,Widnes,Cheshire,"Fourteen objects one every minute, no sound."
10-Oct-09,Willsbridge,Bristol,"Observed three objects in sky for about 10 minutes.  Appeared
stationary and then disappeared behind clouds.  Changed shape
from cigar to round.  Were red or white in colour."
10-Nov-09,Glasgow,Pollock,"Four lights moving around the sky, moving in a formation for over
an hour."
10-Oct-09,Huddersfield,West Yorkshire,Bright orange light travelling slowly.
10-Oct-09,Kirkcaldy,Fife,"Bright orange glow top of Rabbie Brae, hovered near Victoria
Hospital and went up to the sky."
10-Oct-09,Edinburgh,Midlothian,"Two objects, no sound. One object three weeks ago."
10-Oct-09,Beaumaris,Anglesey,"Two triangular orange lights, about 10 seconds apart."
10-Oct-09,Aberdeen,Aberdeenshire,"Nine red lights over the North Sea in a V formation - disappeared
then came back and was there for some time."
11-Oct-09,Crosby,Liverpool,"Triangle shape, with an orange ball in the middle, no noise."
11-Oct-09,Gilberdyke,East Yorkshire,"14 balls of light, no formation, no noise."
11-Oct-09,Not Given,Wigan,"White arrow shaped with green lights, moving slowly."
12-Oct-09,Reservoir,London,Objects seen to land in the reservoir.
12-Oct-09,Plymouth,Dorset,"Orange light, round shape, solid in the middle and straight."
13-Oct-09,Birchington,Kent,Bright lights moving closer.
16-Oct-09,Kirkaldy,Fife,"Orange lights front and back with white lights chasing sounded like
fireworks but no flashes."
16-Oct-09,Saffron Walden,Essex,"Strange cluster of objects at high altitude flying close together
towards London."
16-Oct-09,Gargrave,Skipton,"Three red and orange lights, no noise."
16-Oct-09,Shah Delf area,Nr Oldham,"Slow pulsing orange light, three lots of lights slow speed and silent."
16-Oct-09,March,Cambridgeshire,"Seven orange and red lights, not moving, no shape, disappeared
one after another."
16-Oct-09,West Drayton,Middlesex,"Light, size of a star erratic movements, looped then went out of
sight, reappeared and did futher loop."
17-Oct-09,Leith,Edinburgh,"Fourteen objects, yellowey orangey colour.  Then saw another 8-9.
No sound.  Not on same flight trajectory.  States it could be chinese
lanterns."
17-Oct-09,Not Given,Not Given,Approx 24 objects.
17-Oct-09,Stockton on Tees,Cleveland,Large orange burning object.
17-Oct-09,Orpington,Kent,"Twenty-five lights red and orange with vapour trail, disappearing into
blue green colours, spinning."
17-Oct-09,Enfield,London,No details given.
17-Oct-09,Warburton,Cheshire,"Two orange glowing lights in sky high above Warburton Toll Bridge -
strange shape like a no 7, fuzzy and close together.  No sound."
18-Oct-09,A81 to Strathblane,,"Three orange lights appeared then disappeared behind clouds.
Further orange light and disappeared again."
18-Oct-09,Gee Cross,Cheshire,"Orange yellow bright light travelled fast across sky, followed by
another within 30 secs and repeated around ten times. Three balls of
light - one on top, two either side. No sound."
18-Oct-09,West Ealing,London,"Orange object moving across the sky, flickering."
18-Oct-09,Not Given,Merseyside,"Two Orange lights, no noise, one disappeared, one static hovered
then went away came back and went away again."
18-Oct-09,Not Given,Not Given,"Object wasnt flashing, moved across below cloud then dropped
down to the ground then disappeared."
19-Oct-09,Alton,Staffordshire,"Strange light activity, and lots of helicopters, unusual for the area."
21-Oct-09,Flookburgh,Cumbria,"Strange object in the sky over the sea, far away so difficult to define."
22-Oct-09,Whitehaven,Cumbria,Two orange balls.  No sound. No strobe lights.
23-Oct-09,Rotherham,South Yorkshire,"Glowing object like aircraft on fire from low down over the town
centre rising fast straight up in a straight line across town."
23-Oct-09,Leverton,Boston,Two to four dancing lights with no density to them.
23-Oct-09,Yeovil,Somerset,"Metallic ball in the sky chased by fast jet then helicopter from
Yeovilton."
23-Oct-09,Brigstock,Northamptonshire,"Bright orangey red light lit from one end to the other, no noise,
approx 40 - 50 feet long."
