Date,Town,Area,Incident
18-Nov-99,Crickhowell,Gwent,A vertical orange line near the horizon. Moved to a horizontal position. One inch at arms length.
20-Nov-99,Market Drayton,Shropshire,"A craft with a bright, white light. The craft positioned once and then moved out of sight."
21-Nov-99,Arbroath,Angus,"Single, roundish, orange glowing light. Was moving horizontally across the sky, and away in the distance."
22-Nov-99,Skipton,North Yorkshire,"Two UFOs, red in colour, followed by what appeared to be two jets."
26-Nov-99,Carcroft nr Doncaster,South Yorkshire,"A series of ten green lights in the sky. They formed a formation, then broke formation and headed towards a large light."
28-Nov-99,Pentraeth,Gwynedd,Giant dewdrop shaped object. Had a yellow centre and a green/blue haze around the outside. Too big to be a shooting star.
29-Nov-99,Durham,Tyne & Wear,"Two small, ball shaped objects. Orange in colour. Bright and then dim. They were moving upwards."
29-Nov-99,Tilbury,Essex,"One, green, red and white lights. Lights were brighter, than on an aeroplane or a helicopter. In sky, remaining static."
29-Nov-99,Tilbury,Essex,"One bright star like object, with a green hue surrounding it. Could have been a comet."
29-Nov-99,Tilbury,Essex,"White, star like object, twinkling red and green. Did not move. It was brighter than the other stars."
29-Nov-99,Chadwell St Mary,Essex,One object. Flickering green and red.
29-Nov-99,Dagenham,Essex,"Four lights - blue, yellow, red and white. Four shapes visible through binoculars."
29-Nov-99,Dartford,Kent,"Small light, too far away to ascertain shape. Glittering red, green and white. Did not move."
02-Dec-99,Worthing,East Surrey,Saw a UFO. Said it could have been a shooting star or a comet.
02-Dec-99,Thetford,Norfolk,"One triangular object, with two lights displayed in a similar manner to car headlights. Object rotated about a vertical axis and descended."
03-Dec-99,"Deans, Livingston",West Lothian,The witness just said it was an object.
03-Dec-99,Scunthorpe,Lincolnshire,A large cigar shaped object. The object moved very fast.
04-Dec-99,Newport,Gwent,"A bright, Venus, pale orange object. Was moving as a bird would, in and out of formation."
Date,Town / Village,County,Brief Description of sighting
05-Dec-99,St Peter Port,Guernsey,Six - eight orange blobs. Reasonably light - fuselage. Resembled flight of a bird.
07-Dec-99,Newport,Gwent,One star shaped object. White and very bright. Very erratic movement.
09-Dec-99,Melton/Woodbridge,Somerset,One very large object. Had a tail. Was green in colour and glowing.
09-Dec-99,Orsett,Essex,Large Crystal ball object. The size of a light bulb. Yellowy/white in colour. Travelling in a diagonal direction.
13-Dec-99,Windlesham,Surrey,One object. Like a satellite or star. White and very bright. Very fast.
15-Dec-99,Witham,Essex,One large object. Snowdrop shape. Could be a star/possible satellite. White and very bright. Moving South-East.
15-Dec-99,Glasgow,Strathclyde,"Multiple bright lights. Occasionally red and green. Some were moving and flashing. Streaks of light. Erratic, occasionally in formation and then splitting."
17-Dec-99,Swindon,Wiltshire,Two objects. Had white lights. Brighter as they turned. There was lots of circling and spinning.
17-Dec-99,Dundee,Angus,Three bright piercing lights. Extremely bright. Three then became four.
18-Dec-99,Forest Hill,London,"White glare. Underneath, another glare, red and blue."
19-Dec-99,Whiteley,Hampshire,"A large, bright object hovering in a South West direction. A few seconds later, it vanished."
21-Dec-99,Banchory,Aberdeenshire,One circular object. White and very bright. The object was moving downwards.
28-Dec-99,Swindon,Wiltshire,"One circular object, too big to be a star. Mostly white, but coloured lights too. Moved from right to left at speed."
29-Dec-99,Dundee,Angus,"Bright lights. Cylindrical shape, turning to a V shape. Was moving from East to West."
31-Dec-99,Wigmore,Herefordshire,A large flashing light. It then looked like a white circle flashing in the sky.
No Firm Date,Chobham,Surrey,"A silver object, darting back and forth. Was moving fast and then disappeared quickly. (Message taken - 3 November 1999)."
No Firm date,Hanley,Staffordshire,"Two small dots, cream coloured. Like half way speed between a satellite and shooting star. (Sent to DAS - 10 November 1999)."
,,,